database name,intro,features,coverage,database type,related subjects,access url,function,img,sort
Scite_,Scite is an AI-powered platform for discovering and evaluating scientific articles via Smart Citations that display the context of the citation and describe whether the article provides supporting or contrasting evidence.,Smart citation categories; AI-powered research assistant; Search for facts and insights; Dashboards for trends; reference check; citation context and snippets.,"More than 34.3 million full-text articles and over 1.9 billion unique citations, with broad scholarly coverage across disciplines.",AI research tool,Chemistry|Physics and Materials Science|Food Science and Nutrition|Life Sciences,https://www.lib.polyu.edu.hk/databases/scite,AI Tools,/img/scite.png,1
Consensus,"Consensus is an AI-powered search engine for academic research. It searches a large corpus of peer-reviewed journal articles, along with some conference papers and preprints. This corpus is built from sources such as Semantic Scholar, OpenAlex, and its own web crawl of the scholarly web. Combining both AI-powered semantic search and traditional keyword search, Consensus retrieves and ranks literature based on citation count and journal reputation, then generates concise summaries of the findings with citations.",Evidence-based search; paper summaries; research discovery.,"Broad scholarly coverage, with emphasis on scientific and medical literature.",AI research tool,Chemistry|Physics and Materials Science|Food Science and Nutrition|Life Sciences,,AI Tools,/img/consensus.png,2
Web of Science Research Assistant,"Web of Science, powered by AI, integrates trusted citation data with generative natural-language search and task-based research assistance—streamlining literature discovery, analysis, visualization, and decision-making.",AI-assisted literature discovery; topic exploration; citation-based search.,Multidisciplinary scholarly coverage through Web of Science indexed content.,AI research tool,Chemistry|Physics and Materials Science|Food Science and Nutrition|Life Sciences,,AI Tools,/img/wos.png,3
LeapSpace,"LeapSpace is a unified AI-powered platform built on ScienceDirect full-text and Scopus data, empowering researchers to gain evidence-based insights, accelerate literature discovery, validate claims, identify collaborators and funding opportunities, and make informed decisions with transparent sources from trusted content in Elsevier publications, Trust Cards, and Claim Radar.",Not enough verified information from the provided material to summarize accurately.,Not enough verified information from the provided material to summarize accurately.,AI research tool,Chemistry|Physics and Materials Science|Food Science and Nutrition|Life Sciences,https://www.lib.polyu.edu.hk/databases/leapspace,AI Tools,/img/leapspace.svg,4
OneSearch,"PolyU Library OneSearch is the Library’s main search engine that provides a one-stop platform to discover and access both print and electronic resources with a single search. It helps you quickly find books, e-books, journal articles, AV materials and more, and link through to full text where available.","Unified search; discovery across books, journals, and databases; library holdings search.",Depends on the institution's configured collections and subscriptions.,Library Search Platform,Chemistry|Physics and Materials Science|Food Science and Nutrition|Life Sciences,,Find Book,/img/oneseach.png,1
Scopus,"Scopus is a multi-disciplinary, bibliographic database that indexes the content of over 23,700 peer-reviewed journals. Subject coverage includes life sciences, health sciences, physical sciences, engineering, and social sciences. The database also provides citation numbers for articles published after 1996.",Citation search; analytics; author profiles; journal metrics; subject filtering.,"Broad multidisciplinary coverage across science, technology, medicine, social sciences, and arts/humanities.",abstract and indexing,Chemistry|Physics and Materials Science|Food Science and Nutrition|Life Sciences,https://www.lib.polyu.edu.hk/databases/scopus,A&I,/img/scopus.png,1
Web of Science,"Web of Science, powered by AI, integrates trusted citation data with generative natural-language search and task-based research assistance—streamlining literature discovery, analysis, visualization, and decision-making.",Citation search; citation tracking; analytics; filtering by subject and source type.,Broad multidisciplinary coverage across journal literature and other indexed scholarly content.,abstract and indexing,Chemistry|Physics and Materials Science|Food Science and Nutrition|Life Sciences,https://www.lib.polyu.edu.hk/databases/web-science,A&I,/img/wos.png,2
學術期刊庫 (CNKI),"Academic Journals Database (China Journal Full-text Database) is one of the most complete collections focusing on academic, technical, policy-guiding, higher scientific and educational journals. ",Journal search; full-text access; citation tools; subject browsing.,Extensive coverage of Chinese academic journals and related scholarly materials.,full-text journal,Chemistry|Physics and Materials Science|Food Science and Nutrition|Life Sciences,https://www.lib.polyu.edu.hk/databases/caj-full-text-database-%E4%B8%AD%E5%9C%8B%E6%9C%9F%E5%88%8A%E5%85%A8%E6%96%87%E6%95%B8%E6%93%9A%E5%BA%AB,Find Journal,/img/cnki.png,3
CAS SciFinder,"SciFinder Discovery, an upgraded version of SciFinder-n and SciFinder, is the most comprehensive database and tool for discovering chemical information. It is developed by Chemical Abstracts Service (CAS). Its contents include journal articles, information on chemical structures, properties, reactions, analytical methods, formulas, and life science data. Users can search literature by topic, author, and search substances by name or CAS Registry Number, or drawing a chemical structure. ",Substance search; reaction search; reference search; patent and literature linking.,"Strong coverage in chemistry, chemical engineering, materials, and related sciences.",full-text journal. patent,Chemistry|Physics and Materials Science|Life Sciences,https://www.lib.polyu.edu.hk/databases/scifinder%20discovery,Find Article,/img/scifinder.png,4
JoVE,"JoVE (Journal of Visualized Experiments) provides a rich collection of videos on scientific techniques and methodologies to support teaching and learning. As a video journal, it also publishes peer-reviewed scientific video protocols to accelerate biological, medical, chemical and physical research.",Video-based protocols; step-by-step experimental methods; searchable articles.,"Experimental methods across life sciences, medicine, chemistry, and related fields.",multimedia,Chemistry|Physics and Materials Science|Food Science and Nutrition|Life Sciences,https://www.lib.polyu.edu.hk/databases/jove,Experiment Design,/img/jove.png,1
Springer Protocols,Springer Protocols is a database of reproducible laboratory protocols in biomedicine and life sciences. The platform contains nearly 40 years of protocols.,Detailed protocols; searchable methods; discipline filters.,"Strong coverage of life sciences, biomedical research, and laboratory methods.",experiment,Life Sciences,https://www.lib.polyu.edu.hk/databases/springer-protocols,Experiment Design,/img/springer_protocols.svg,2
ASTM Compass,"ASTM Compass provides access to technical standards, books, journals and technical reports published by American Society for Testing and Materials (ASTM). It also covers standards co-developed by other organizations such as ISO and BSI. The platform allows you to check historical, withdrawn and redline versions, compare versions of standards and make annotations. ",Standards search; technical documents; version access; related publications.,Coverage of ASTM standards and related technical content.,standard,Chemistry|Physics and Materials Science,https://www.lib.polyu.edu.hk/databases/aatcc,Find Standard,/img/astm_compass.png,1
British Standards Online (BSOL),British Standards Online (BSOL). BSI collection provides full access to British Standards (BSI). ISO collection provides full access to technical standards published by ISO (International Organization for Standardization). ,Standards search; full-text standards; version control; alerts.,"Broad standards coverage, especially BS and ISO-adopted standards.",standard,Chemistry|Physics and Materials Science|Food Science and Nutrition|Life Sciences,https://www.lib.polyu.edu.hk/databases/british-standards-online-bsol,Find Standard,/img/bsi.png,2
Lens.org,"Patent and scholarly search platform that links literature, patents, and innovation data.",Patent search; scholarly search; analytics; linking patents to publications.,Broad coverage of patents and scholarly literature.,patent,Chemistry|Physics and Materials Science|Food Science and Nutrition|Life Sciences,,Find Patent,/img/lens.png,1
WIPO PATENTSCOPE,Patent search database maintained by WIPO for international patent applications and related records.,Patent search; multilingual search; document retrieval; legal status information.,International patent applications and patent collection records.,patent,Food Science and Nutrition|Life Sciences,,Find Patent,/img/wipo.png,2
Google Patent,Patent search interface for finding patent documents and related information.,Keyword search; patent browsing; full document access; citations.,Broad patent literature coverage across jurisdictions.,patent,Chemistry|Physics and Materials Science|Food Science and Nutrition|Life Sciences,,Find Patent,/img/google-patent.png,3
American Physical Society (APS),"American Physical Society (APS) Journals collection consists of a number of leading peer-reviewed research journals in physics and related subjects, including Physical Review Letters, Physical Review X, Physical Review, and Reviews of Modern Physics.",Journal search; article access; citations; alerts.,Physics and related subfields through APS journals.,publisher,Physics and Materials Science,https://www.lib.polyu.edu.hk/databases/aps-journals,Publisher,/img/aps.svg,1
Royal Society of Chemistry (RSC),"RSC Journals offers full-text of current chemistry journals published by the Royal Society of Chemistry (RSC). The database of journal articles is searchable by journal title, article title, author, issue number and date.",Article search; journal access; citations; alerts.,Chemistry and related chemical sciences.,publisher,Chemistry|Food Science and Nutrition|Life Sciences,https://www.lib.polyu.edu.hk/databases/rsc-journals,Publisher,/img/rsc.png,2
American Chemical Society (ACS),The collection provides access to the full-text articles of selected titles published (or co-published) by American Chemical Society (ACS).,Article search; journal access; alerts; citation tools.,"Chemistry, chemical engineering, and related sciences.",publisher,Chemistry|Food Science and Nutrition|Life Sciences,https://www.lib.polyu.edu.hk/databases/acs-publications-journals-and-magazines,Publisher,/img/acs.png,3
Institute of Physics (IOP),Provides access to full articles of the selected journals published by Institute of Physics (IOP).  ,Journal search; article access; citations; alerts.,"Physics, materials science, and related fields.",publisher,Physics and Materials Science,https://www.lib.polyu.edu.hk/databases/iop-electronic-journals,Publisher,/img/iop.png,4
Nature,"Provides full-text access to articles from all journals published by Nature Publishing Group. The journals cover cell biology, biotechnology, immunology, genetics, neuroscience, and structural biology. ",Article search; journal browsing; alerts; citation links.,Multidisciplinary research across science and medicine.,publisher,Physics and Materials Science|Chemistry|Life Sciences,https://www.lib.polyu.edu.hk/databases/nature-publishing-group-journals,Publisher,/img/nature.svg,5
